{
  "$schema":"ubuddy-cp-rir-req-registry-separation-v0.schema.json","schemaVersion":"cp-rir/req-registry-separation/v0","status":"illustrative_v0_draft","cases":[
    {"caseId":"CC_FALSE_OC_NOT_EVALUATED","registry":{"registryId":"req-registry-v1","registryDigest":"1111111111111111111111111111111111111111111111111111111111111111","independentFromCandidate":true,"lockedBeforeCandidate":true,"obligations":[{"id":"Req-S1","kind":"HARD","required":true,"multiplicity":1,"trigger":"effect-request","discharge":"signed-receipt","deadline":"tick<=5"},{"id":"Req-S2","kind":"HARD","required":true,"multiplicity":1,"trigger":"effect-request","discharge":"signed-receipt","deadline":"tick<=5"}]},"contractBefore":{"scope":"cross-owner","inputDomain":["request"],"obligationIds":["Req-S1","Req-S2"],"footprint":"s1,s2","projection":"public-cut-v1","exceptionPolicy":"abstain-only","deadline":"","attemptLimit":2,"freshness":"epoch","idempotence":"keyed","authorization":"owner","evaluator":"locked-u","costModel":"positive-additive"},"contractAfter":{"scope":"cross-owner","inputDomain":["request"],"obligationIds":["Req-S1","Req-S2"],"footprint":"s1,s2","projection":"public-cut-v1","exceptionPolicy":"abstain-only","deadline":"","attemptLimit":2,"freshness":"epoch","idempotence":"keyed","authorization":"owner","evaluator":"locked-u","costModel":"positive-additive"},"implementationStatus":"planned/unverified"},
    {"caseId":"CC_TRUE_OC_FALSE","registry":{"registryId":"req-registry-v1","registryDigest":"2222222222222222222222222222222222222222222222222222222222222222","independentFromCandidate":true,"lockedBeforeCandidate":true,"obligations":[{"id":"Req-S1","kind":"HARD","required":true,"multiplicity":1,"trigger":"effect-request","discharge":"signed-receipt","deadline":"tick<=5"},{"id":"Req-S2","kind":"HARD","required":true,"multiplicity":1,"trigger":"effect-request","discharge":"signed-receipt","deadline":"tick<=5"}]},"contractBefore":{"scope":"cross-owner","inputDomain":["request"],"obligationIds":["Req-S1","Req-S2"],"footprint":"s1,s2","projection":"public-cut-v1","exceptionPolicy":"abstain-only","deadline":"tick<=5","attemptLimit":2,"freshness":"epoch","idempotence":"keyed","authorization":"owner","evaluator":"locked-u","costModel":"positive-additive"},"contractAfter":{"scope":"cross-owner","inputDomain":["request"],"obligationIds":["Req-S1"],"footprint":"s1,s2","projection":"public-cut-v1","exceptionPolicy":"abstain-only","deadline":"tick<=5","attemptLimit":2,"freshness":"epoch","idempotence":"keyed","authorization":"owner","evaluator":"locked-u","costModel":"positive-additive"},"implementationStatus":"planned/unverified"}
  ],"implementationStatus":"planned/unverified"
}
